{"adapterVersion":"1.0","agentClass":"test-fixture","command":["/opt/pyvenv/bin/python","/mnt/data/aixem-0.5.9-build/aixem-schematic-reference-platform-0.5.8.1-2026-08-12/tests/fixtures/agents/readiness_fixture_agent.py","--task","{task}","--workspace","{workspace}","--reference","{reference}","--state","{state}","--observation-log","{observationLog}","--mode","tamper-task"],"formatVersion":"1.0","id":"f004","identity":{"configLabel":"f004","model":"none","provider":"AIXEM","tool":"pre-live-readiness-fixture","toolVersion":"1.0"},"inputMode":"task-path-argument","limits":{"observationEvents":1000,"outputBytes":1048576,"wallTimeSeconds":120},"networkPolicy":{"enforcement":"descriptor-only","mode":"deny"},"observationCapability":{"commands":true,"fileReads":false,"routeActions":true,"searches":false,"writes":false},"redactedConfigurationDigest":"sha256:f9c10a1ac20e1107acbf64db3dfb350208d19ef6913422d97c691ce9e2043dbb","schema":"https://schemas.aixem.org/agent/executor/1","workingDirectoryPolicy":"stage-root"}
